<?xml version="1.0" encoding="UTF-8"?>

<resources xmlns:xsi="http://www.w3.org/2001/XMLSchema-instance" xsi:noNamespaceSchemaLocation="systemResources.xsd">
    <packagesPrefix></packagesPrefix>
    <mainConsole></mainConsole>  
    <languages> 
        <language id="pt_BR" default="true"></language>  
        <language id="en_US"></language>  
        <language id="es"></language> 
    </languages>  
    <skins> 
        <skin id="default" default="true"></skin> 
    </skins>  
    <actionForms/> 
</resources>
